{
  "request_id": "issue-16-golden-003",
  "workspace_id": "workspace-pilot",
  "family_key": "mss_sow",
  "options": {
    "tier": "premium",
    "channel": "resell",
    "addon_siem": "yes",
    "addon_firewall": "no",
    "addon_storage": "yes",
    "addon_endpoint_patching": "no",
    "addon_sentinelone": "yes",
    "include_slo": "no"
  },
  "placeholder_values": {
    "CUSTOMER_NAME": "Test Customer Gamma",
    "CUSTOMER_LOGO": "logo-placeholder",
    "CUSTOMER_CONTACT_NAME": "Carol White",
    "CUSTOMER_CONTACT_TITLE": "IT Director",
    "ACCOUNT_MANAGER_NAME": "Dave Green",
    "SOW_DATE": "2026-03-01",
    "QUOTE_NUMBER": "M4RR-1002",
    "REVISION_NUMBER": "Rev 1",
    "MSA_DATE": "2026-02-01",
    "ORDER_START_DATE": "2026-04-01",
    "HOT_STORAGE_MONTHS": "6",
    "COLD_STORAGE_MONTHS": "12",
    "POC_FEE_MONTHLY": "4000",
    "TERM_FEE_MONTHLY": "7000",
    "REMAINDER_FEE_MONTHLY": "7000",
    "MIN_ENDPOINT_COUNT": "60",
    "SERVICE_TIER_FULL_NAME": "Premium"
  },
  "requested_by": "test@example.com"
}
