{
  "request_id": "golden-mss-sow-002",
  "workspace_id": "workspace-pilot",
  "family_key": "mss_sow",
  "options": {
    "tier": "enterprise",
    "channel": "refer",
    "addon_siem": "no",
    "addon_firewall": "no",
    "addon_storage": "no",
    "addon_endpoint_patching": "no",
    "addon_sentinelone": "no",
    "include_slo": "no"
  },
  "placeholder_values": {
    "CUSTOMER_NAME": "Test Customer Beta",
    "CUSTOMER_LOGO": "logo-placeholder",
    "CUSTOMER_CONTACT_NAME": "Bob Jones",
    "CUSTOMER_CONTACT_TITLE": "VP IT",
    "ACCOUNT_MANAGER_NAME": "Alice Brown",
    "SOW_DATE": "2026-02-01",
    "QUOTE_NUMBER": "M4RF-1001",
    "REVISION_NUMBER": "Original",
    "MSA_DATE": "2026-01-01",
    "ORDER_START_DATE": "2026-03-01",
    "HOT_STORAGE_MONTHS": "12",
    "COLD_STORAGE_MONTHS": "24",
    "POC_FEE_MONTHLY": "6000",
    "TERM_FEE_MONTHLY": "10000",
    "REMAINDER_FEE_MONTHLY": "10000",
    "MIN_ENDPOINT_COUNT": "120"
  },
  "requested_by": "test@example.com"
}
