{
  "request_id": "golden-mss-sow-004",
  "workspace_id": "workspace-pilot",
  "family_key": "mss_sow",
  "options": {
    "tier": "strategic",
    "channel": "refer",
    "addon_siem": "no",
    "addon_firewall": "yes",
    "addon_storage": "no",
    "addon_endpoint_patching": "yes",
    "addon_sentinelone": "no",
    "include_slo": "yes"
  },
  "placeholder_values": {
    "CUSTOMER_NAME": "Test Customer Delta",
    "CUSTOMER_LOGO": "logo-placeholder",
    "CUSTOMER_CONTACT_NAME": "Eve Black",
    "CUSTOMER_CONTACT_TITLE": "CTO",
    "ACCOUNT_MANAGER_NAME": "Frank Red",
    "SOW_DATE": "2026-04-01",
    "QUOTE_NUMBER": "M4RF-1002",
    "REVISION_NUMBER": "Original",
    "MSA_DATE": "2026-03-01",
    "ORDER_START_DATE": "2026-05-01",
    "HOT_STORAGE_MONTHS": "12",
    "COLD_STORAGE_MONTHS": "36",
    "POC_FEE_MONTHLY": "7000",
    "TERM_FEE_MONTHLY": "12000",
    "REMAINDER_FEE_MONTHLY": "12000",
    "MIN_ENDPOINT_COUNT": "60"
  },
  "requested_by": "test@example.com"
}
