{
  "request_id": "issue-16-golden-007",
  "workspace_id": "workspace-pilot",
  "family_key": "mss_sow",
  "options": {
    "tier": "premium",
    "channel": "refer",
    "addon_siem": "no",
    "addon_firewall": "yes",
    "addon_storage": "no",
    "addon_endpoint_patching": "no",
    "addon_sentinelone": "no",
    "include_slo": "yes"
  },
  "placeholder_values": {
    "CUSTOMER_NAME": "Test Customer Eta",
    "CUSTOMER_LOGO": "logo-placeholder",
    "CUSTOMER_CONTACT_NAME": "Karen Price",
    "CUSTOMER_CONTACT_TITLE": "IT Manager",
    "ACCOUNT_MANAGER_NAME": "Leo Stone",
    "SOW_DATE": "2026-07-01",
    "QUOTE_NUMBER": "M4RF-1004",
    "REVISION_NUMBER": "Original",
    "MSA_DATE": "2026-06-01",
    "ORDER_START_DATE": "2026-08-01",
    "HOT_STORAGE_MONTHS": "12",
    "COLD_STORAGE_MONTHS": "24",
    "POC_FEE_MONTHLY": "4000",
    "TERM_FEE_MONTHLY": "7500",
    "REMAINDER_FEE_MONTHLY": "7500",
    "MIN_ENDPOINT_COUNT": "50"
  },
  "requested_by": "test@example.com"
}
